asin,title,imgUrl,productURL,stars,reviews,price,listPrice,categoryName,isBestSeller,boughtInLastMonth
B08Y88X537,"Sailstar G9 LED Bulb Warm White 3000K 40W Halogen Equivalent G9 LED Light Bulbs 4W G9 Bipin Base, 120V 400 Lumen 360°Beam Angle, Non-Dimmable Ceramic Base G9 Bulbs for Chandelier, Pack of 6",https://m.media-amazon.com/images/I/71ZM8QR9DbL._AC_UL320_.jpg,https://www.amazon.ca/dp/B08Y88X537,4.5,189,13.99,0,Industrial  Scientific,FALSE,50
B09NBS5KJJ,"6492 Reward Stickers for Kids School - 60 Sheets of Teacher Stickers for Students, Mini Stickers for Teachers, Stickers Teacher, Small Stickers, School Stickers, Tiny Stickers, Teacher Sticker Pack",https://m.media-amazon.com/images/I/A1ACCpvkSaL._AC_UL320_.jpg,https://www.amazon.ca/dp/B09NBS5KJJ,4.7,158,15.99,0,Industrial  Scientific,FALSE,50
B0C4FZHPR9,"3D Printer PLA Filament Silk Dual Color, 3D Filament Coextrusion Color Changing 1.75mm, Fit FDM +/- 0.03mm 1KG Spool, Silk Blue and Green",https://m.media-amazon.com/images/I/81yudJ1iwjL._AC_UL320_.jpg,https://www.amazon.ca/dp/B0C4FZHPR9,4.2,33,26.98,0,Industrial  Scientific,FALSE,0
B0BS25KKQF,"GYOFFULL Crosscut Sled for Table Saw UHMW Plastic 3/4"" X 3/8"" X 17"" with Predrilled Holes and Screws Ideal for T Tracks Woodworking, Router Table and Bandsaws(4 Bars)",https://m.media-amazon.com/images/I/61afTQOUXUL._AC_UL320_.jpg,https://www.amazon.ca/dp/B0BS25KKQF,4,34,24.99,0,Industrial  Scientific,FALSE,50
B09ZF47VXX,DEWALT Fixed Bar Screwdriver Set (10 pc.) (DWHT65201),https://m.media-amazon.com/images/I/71xIwDJRKbL._AC_UL320_.jpg,https://www.amazon.ca/dp/B09ZF47VXX,4.8,422,60.08,0,Industrial  Scientific,FALSE,0
B0C2HMQB15,"AnkerMake M5C 3D Printer, 500 mm/s High-Speed Printing, 50 μm Resolution, All-Metal Hotend, Supports 300℃ Printing, Control via Multi-Device, Intuitive, Auto-Leveling, 220×220×250 mm Print Volume",https://m.media-amazon.com/images/I/519rRSfUaPL._AC_UL320_.jpg,https://www.amazon.ca/dp/B0C2HMQB15,4.2,72,699,0,Industrial  Scientific,FALSE,0
B09YHMB4HW,1/4” Air Sandblasting Gun Portable Handheld Sandblaster 90psi Gravity Sandblasting Gun Pneumatic Sandblaster Spray Gun Blasting Machine,https://m.media-amazon.com/images/I/41iLdHMoQjL._AC_UL320_.jpg,https://www.amazon.ca/dp/B09YHMB4HW,3.3,120,17.79,0,Industrial  Scientific,FALSE,0
B08CRDBGX1,"HWASHIN 100 Pack 2ml (5/8 Dram) Amber Mini Glass Essential Oils Sample Bottles with Black Caps for Essential Oils, Perfumes & Lab Chemicals (30ml Measuring Cup and 5 Droppers Included)",https://m.media-amazon.com/images/I/71K1eVE16UL._AC_UL320_.jpg,https://www.amazon.ca/dp/B08CRDBGX1,4.4,217,21.99,25.99,Industrial  Scientific,FALSE,0
B09WDGT8NH,"First Aid Bag Empty, Adjustable Emergency Medical Supplies Storage Bag Home Health Nurse Bag with Detachable Dividers",https://m.media-amazon.com/images/I/719RfPjn6eL._AC_UL320_.jpg,https://www.amazon.ca/dp/B09WDGT8NH,4.6,139,37.99,0,Industrial  Scientific,FALSE,50
B08M69S67H,"Nanxudyj USB 3.0 Extension Cable 20ft,USB Extender Cable Type A Male to A Female Data Transfer Cord 5Gbps for Playstation,Xbox,Oculus VR, USB Flash Drive,Card Reader,Hard Drive,Keyboard,Printer 6M",https://m.media-amazon.com/images/I/81LW55hOhsL._AC_UL320_.jpg,https://www.amazon.ca/dp/B08M69S67H,4.7,298,20.99,0,Industrial  Scientific,FALSE,0
B01MXYQYNL,"Vstar® 10 Watt G4 T3 Base 12Volt 2500 Hours Light Bulb Landscape,10 Pack",https://m.media-amazon.com/images/I/61GkdtxW-aL._AC_UL320_.jpg,https://www.amazon.ca/dp/B01MXYQYNL,4.6,370,8.78,0,Industrial  Scientific,FALSE,100
B08TBW22FL,"Wet Dry Sandpaper, Waterproof 120/240/400/600/800/1500/2000/3000 Sand Paper Sheet for Wood Metal Polishing Automotive Polishing (16 Pcs)",https://m.media-amazon.com/images/I/61Yxl2nRjTS._AC_UL320_.jpg,https://www.amazon.ca/dp/B08TBW22FL,4.3,196,12.49,0,Industrial  Scientific,FALSE,100
B089G4JL2B,"Door Stop Alarm Stopper Security Alarm Wedge with 120dB Loud Wedge, Home Apartment Traveling Security Door Stopper Door Stop Safety Tools(Battery not Include)",https://m.media-amazon.com/images/I/31+uKIOoTfL._AC_UL320_.jpg,https://www.amazon.ca/dp/B089G4JL2B,4,226,14.99,0,Industrial  Scientific,FALSE,0
B0CF5GPH7P,"Patio Sliding Door Handle Set Thickening Coating Rust-proof Sliding Glass Door Handle with lock for Patio/Bathroom Partitions/Balcony/Terrace/Kitchen Doors Fits Thickness from 1-1/5"" to 2-1/4"" (White)",https://m.media-amazon.com/images/I/61ueYNXZBbL._AC_UL320_.jpg,https://www.amazon.ca/dp/B0CF5GPH7P,4.7,14,57.99,0,Industrial  Scientific,FALSE,0
B09NLMS48Q,"3Pack iPhone Charger 10 ft,Long Lightning Cable 10 Foot,[Apple MFi Certified] Fast 10 Feet Charging Cables Cord,iPhone Charger Cord Compatible with iPhone 14 13 12 11 Pro Max XS MAX XR Plus iPad iPod",https://m.media-amazon.com/images/I/619dzH4V5TL._AC_UL320_.jpg,https://www.amazon.ca/dp/B09NLMS48Q,4.2,93,22.99,0,Industrial  Scientific,FALSE,50
B00020J1Q2,Bosch PA1202 Pair of Woodrazor Tungsten Carbide Planer Blades,https://m.media-amazon.com/images/I/418K82b-0ML._AC_UL320_.jpg,https://www.amazon.ca/dp/B00020J1Q2,4.6,1155,24.32,0,Industrial  Scientific,FALSE,0
B08GM19XFC,"Glass Dropper 10 PCS Eye Dropper for Essential Oils,Straight-Tip Calibrated 1 ml Capacity Pipette Droppers With Highly-Functional Suction that Hold Fluids Medicines and Essential Oils",https://m.media-amazon.com/images/I/51fvh2Ye6bL._AC_UL320_.jpg,https://www.amazon.ca/dp/B08GM19XFC,4.4,212,12.92,0,Industrial  Scientific,FALSE,100
B09V7N1FPW,"BITOPE Squeegee for Window Cleaning, Long Handle Cleaner Tool with Extension Pole,11”Microfiber Cloth and 12”Wide Squeegee Cleaner Kit for Car,Shower Glass Door,High Windows",https://m.media-amazon.com/images/I/714VISM1AoL._AC_UL320_.jpg,https://www.amazon.ca/dp/B09V7N1FPW,4,164,31.89,0,Industrial  Scientific,FALSE,50
B07XDNSXBY,"Ailelan Elbow Brace, 2-Pack Tennis Elbow Brace with Compression Pad, Tennis Elbow Strap for Men and Women, Pain Relief for Tendonitis",https://m.media-amazon.com/images/I/71rQuFruflL._AC_UL320_.jpg,https://www.amazon.ca/dp/B07XDNSXBY,4,531,13.99,0,Industrial  Scientific,FALSE,50
B0B2QPFG1K,"FITNATE Keyless Smart Lock Digital Door Lock with Keypad, Waterproof Electronic Keypad Door Lock with Spare Keys, Great for Home, Hotel and Office,Silver",https://m.media-amazon.com/images/I/71NgpxvHsxL._AC_UL320_.jpg,https://www.amazon.ca/dp/B0B2QPFG1K,4.1,112,69.99,0,Industrial  Scientific,FALSE,0
B0BTHS1LMS,20FT 1/4 Inch T-End U+O Ring Shape Garage Door Bottom Seals Weatherproof Weatherstrip Threshold Buffering Sealing High Performance EPDM Rubber Weather Resistance Gasket，Black,https://m.media-amazon.com/images/I/51I0KCA+L-L._AC_UL320_.jpg,https://www.amazon.ca/dp/B0BTHS1LMS,4.6,49,42.99,0,Industrial  Scientific,FALSE,0
B01M7N0P2K,"New Life Products 9-1141- SP1 Bi-Fold Door/Closet Door Repair Kit, for 7/8 in. Wide bi-fold Door Track",https://m.media-amazon.com/images/I/81fsFEHh2VL._AC_UL320_.jpg,https://www.amazon.ca/dp/B01M7N0P2K,4.5,79,15.95,0,Industrial  Scientific,FALSE,50
B0C3QB4DV3,"Inside Pipe Cutter for PVC Pipe Cutter Tool with Adjustable Depth Gauge Guide, 5pcs Saw Tooth Blades with 0.315Inch Hex Key Shaft, Plumbing Internal Plastic ABS Pipe Cutter Set",https://m.media-amazon.com/images/I/61BqTlXDckL._AC_UL320_.jpg,https://www.amazon.ca/dp/B0C3QB4DV3,4.2,31,39.99,0,Industrial  Scientific,FALSE,0
B095PYDPSK,"Shark UltraCyclone Pet Pro Cordless Handheld Vacuum (CH950C) - Canadian Version, Maroon XL Dust cup",https://m.media-amazon.com/images/I/71yzrpgjzcS._AC_UL320_.jpg,https://www.amazon.ca/dp/B095PYDPSK,4.4,358,109.98,0,Industrial  Scientific,FALSE,100
B00FGRZE9Y,"Philips 220913 Fluorescent 14W T5 22"" Soft White (3000K)",https://m.media-amazon.com/images/I/41ugyQc6IOL._AC_UL320_.jpg,https://www.amazon.ca/dp/B00FGRZE9Y,4.4,83,17.97,0,Industrial  Scientific,FALSE,0
B0BFH61K4K,"COOLJOB Work Gloves for Men & Women, 3 Pairs Non-Slip Dotted Nitrile Coated Safety Work Gloves, Oil Resistant Breathable Working Gloves for Construction, Gardening, Mechanics, Medium, 3 Pairs M",https://m.media-amazon.com/images/I/71tz-JnyccL._AC_UL320_.jpg,https://www.amazon.ca/dp/B0BFH61K4K,4.4,68,19.99,0,Industrial  Scientific,FALSE,0
B084MBRTJS,TIMEMORE Black Mirror Basic Plus Coffee Scale Digital Auto-Timing for Pour-Over Hand Drip,https://m.media-amazon.com/images/I/41gXcHSpBTL._AC_UL320_.jpg,https://www.amazon.ca/dp/B084MBRTJS,4.3,176,77.99,0,Industrial  Scientific,FALSE,0
B0BHTHHJX6,"Silicone Ear Plugs for Sleeping,12 Pairs Reusable Earplugs Noise Reduction Ear Plugs Soft Waterproof Earplugs Hearing Protection for Concert,Swimming,Study,Loud Noise,Snoring",https://m.media-amazon.com/images/I/61GPuO9c4jL._AC_UL320_.jpg,https://www.amazon.ca/dp/B0BHTHHJX6,4.4,165,11.93,0,Industrial  Scientific,FALSE,50
B0B29G629K,"3Pcs Impact Grade Driver Sockets Drill Adapter Extension Set 1/4"", 1/2"", 3/8 Reducer Set Turns Power Drill Into High Speed Nut Driver Socket to Drill Adpater Drill Hex Bit Socket Adapter",https://m.media-amazon.com/images/I/61sPnaSLcJL._AC_UL320_.jpg,https://www.amazon.ca/dp/B0B29G629K,4.4,124,8.99,0,Industrial  Scientific,FALSE,0
B071CPN473,AUSTOR 60 Pieces Mouse Detail Sander Sandpaper Sanding Paper Hook and Loop Assorted 40/60/ 80/120/ 180/240 Grits,https://m.media-amazon.com/images/I/71ZsRP6V-VL._AC_UL320_.jpg,https://www.amazon.ca/dp/B071CPN473,4.4,5256,20.99,0,Industrial  Scientific,FALSE,50
B01J6QJE5K,"Wet Look Natural Stone Sealer From Black Diamond Stoneworks Provides Durable Gloss and Protection to: Slate, Stone, Concrete, Brick, Block, Pavers, Sandstone, Driveways, Garage Floors. Interior or Exterior. (Trial)",https://m.media-amazon.com/images/I/81FHGdWlJ0L._AC_UL320_.jpg,https://www.amazon.ca/dp/B01J6QJE5K,4.1,2764,14.98,0,Industrial  Scientific,FALSE,100
B000P0DPGQ,"First Alert Fire Extinguisher, Car Fire Extinguisher, Red, AUTO5",https://m.media-amazon.com/images/I/51W-1pyiTQL._AC_UL320_.jpg,https://www.amazon.ca/dp/B000P0DPGQ,4.5,224,43.8,0,Industrial  Scientific,FALSE,0
B07WQG85HV,"CNC Spoilboard Surfacing Router Bit, 1/2-Inch Shank 2-Inch Cutting Diameter, Slab Flattening Router Bit Planing Wood Planer Bit by BINSTAK (Carbide)",https://m.media-amazon.com/images/I/61NjpfHVPHS._AC_UL320_.jpg,https://www.amazon.ca/dp/B07WQG85HV,4.4,2069,28.78,0,Industrial  Scientific,FALSE,50
B07MJM6F8T,"Kasonic 25 Ft Extension Cord with 3 Outlets, UL Listed 16/3 SJTW, 3-Wire Grounded, 13A 125V 1625W for Indoor/Outdoor Use - Green",https://m.media-amazon.com/images/I/615wQ3x051L._AC_UL320_.jpg,https://www.amazon.ca/dp/B07MJM6F8T,4.7,966,28.99,0,Industrial  Scientific,FALSE,0
B09Q64GYVP,"SUNLU 3D Printer Resin, 1000g Standard Photopolymer Fast Curing Resin for LCD/DLP/SLA Resin 3D Printer, 405nm UV Curing 3D Printing Resin, Low Shrinkage, High Precision, 1kg, Grey",https://m.media-amazon.com/images/I/71LmrhVY4HL._AC_UL320_.jpg,https://www.amazon.ca/dp/B09Q64GYVP,4.6,831,33.99,60.35,Industrial  Scientific,FALSE,0
B08B3GNL1S,"USB C GaN Charger 30W, iPad Fast Charger with 6.6FT USB C to Lightning Cable Mfi Certified, iPhone Lightning Charger for iPad Pro/iPad Air/iPhone 14/14 Pro/14 Pro Max/13/12/11/XS",https://m.media-amazon.com/images/I/512u1vRnMzL._AC_UL320_.jpg,https://www.amazon.ca/dp/B08B3GNL1S,4.5,1162,27.99,0,Industrial  Scientific,FALSE,0
B07GZHSCP6,PEAKTOW PTT0023 Heavy Duty 6-7/8” Metal Lock Barrel Bolt Spring Loaded Latch W/Hardware for Gate Door Tailgate Trailer Garage 2PK,https://m.media-amazon.com/images/I/81Kxu0C48BL._AC_UL320_.jpg,https://www.amazon.ca/dp/B07GZHSCP6,4.6,364,16.99,17.99,Industrial  Scientific,FALSE,50
B09XQ7SF3N,"ARENTA 200Pcs 3X2mm Mini Frigerator Magnets with Strong Neodymium, Small Refridge Magnets Used as Office Whiteboards Magnets, DIY and Crafts Magnets, Map Magnets, Tiny Round Magnets for Multi-Use",https://m.media-amazon.com/images/I/61BbSf9Et6L._AC_UL320_.jpg,https://www.amazon.ca/dp/B09XQ7SF3N,4,121,11.99,0,Industrial  Scientific,FALSE,100
B09YHY8ZP5,"EPAuto 1/2-inch Drive Click Torque Wrench, 10~150 ft./lb., 13.6~203.5 N/m, Black",https://m.media-amazon.com/images/I/81mnK50CBpL._AC_UL320_.jpg,https://www.amazon.ca/dp/B09YHY8ZP5,4.4,732,48.87,0,Industrial  Scientific,FALSE,0
B00X4N3SLI,"Petrol Gel Food Grade Equipment Lubricant NSF (2 Pack), 2/4 Oz",https://m.media-amazon.com/images/I/71dLSnoZQRL._AC_UL320_.jpg,https://www.amazon.ca/dp/B00X4N3SLI,4.5,277,18.99,0,Industrial  Scientific,FALSE,50
B000BQY8E2,"Anderson Metals - 56120-0808 Brass Pipe Fitting, Adapter, 1/2"" Male Pipe x 1/2"" Female Pipe",https://m.media-amazon.com/images/I/715TAaBQqaL._AC_UL320_.jpg,https://www.amazon.ca/dp/B000BQY8E2,4.4,2572,8.47,0,Industrial  Scientific,TRUE,100
B08RNJ1K7L,"Infrared Thermometer Gun for Cooking, INKBIRD Digital Laser Temperature Gun -58℉-1022℉(-50℃-550℃), IR Laser Thermometer Gun INK-IFT01, Adjustable Emissivity, Kitchen Thermometer for Pizza Oven BBQ",https://m.media-amazon.com/images/I/718BxoFNlTL._AC_UL320_.jpg,https://www.amazon.ca/dp/B08RNJ1K7L,4.4,553,33.98,0,Industrial  Scientific,FALSE,0
B004W7WMTE,"Scotch-Brite 496 Pot Pan and Dish Brush, 1 Count",https://m.media-amazon.com/images/I/61xFZPMe4ZL._AC_UL320_.jpg,https://www.amazon.ca/dp/B004W7WMTE,4.7,1584,6.13,0,Industrial  Scientific,FALSE,50
B0BWTTNMTT,"Grtard 8Pack Neodymium Magnets Heavy Duty, Powerful Permanent Rare Earth Magnets, Super Strong Neodymium Disc Magnets with Double-Sided Adhesive for DIY, Building, Fridge, Craft, Office - 1.18”D x 0.12”H",https://m.media-amazon.com/images/I/71ybtFi1zpL._AC_UL320_.jpg,https://www.amazon.ca/dp/B0BWTTNMTT,4.5,11,17.99,0,Industrial  Scientific,FALSE,100
B0BM92W5Z2,"2 Gram [50 Packets] Fonday Food Grade Silica Gel Packs Desiccants - Moisture Absorbers, Desiccants Packets Dehumidifier Packs",https://m.media-amazon.com/images/I/71YZu0xMXLL._AC_UL320_.jpg,https://www.amazon.ca/dp/B0BM92W5Z2,4.5,622,9.99,0,Industrial  Scientific,FALSE,0
B07F93VZRB,Arctic Silver 3.5g High-Density Polysynthetic Silver Thermal Cooling Compound AS5-3.5G (1 Pack with Tool),https://m.media-amazon.com/images/I/51Mjjat7GfL._AC_UL320_.jpg,https://www.amazon.ca/dp/B07F93VZRB,4.7,1417,13.49,14.99,Industrial  Scientific,FALSE,0
B01H4ZLZLQ,Elegoo MEGA 2560 R3 Board ATmega2560 ATMEGA16U2 + USB Cable for Arduino,https://m.media-amazon.com/images/I/81kXRQfMJtL._AC_UL320_.jpg,https://www.amazon.ca/dp/B01H4ZLZLQ,4.7,2658,29.95,0,Industrial  Scientific,FALSE,50
B09H2FFGNG,"50/100PCS Kids Disposable Face_Masks for Kids 4 Layers Protection 3D Type Non-Woven Face_Mask Disposable (Five Color-2,50 PCS)",https://m.media-amazon.com/images/I/61nL8HXhbvL._AC_UL320_.jpg,https://www.amazon.ca/dp/B09H2FFGNG,4.2,265,15.99,0,Industrial  Scientific,FALSE,50
B0C8PQRNQY,"140W USB C Magnetic Adapter, 2m 6.56ft Type USB C to Mag Safe 3 Charging Cable Cord PD Fast Charger Compatible with MacBook Pro 2021 M1 Pro 2023 M2 Pro Air",https://m.media-amazon.com/images/I/615FOyYHRZL._AC_UL320_.jpg,https://www.amazon.ca/dp/B0C8PQRNQY,0,0,29.39,0,Industrial  Scientific,FALSE,0
B088RBWX9V,"Precision Screwdriver Set, LIFEGOO Magnetic Eyeglass Repair Tool Kit for iPhone/Mac/Nintendo Switch/Series/PS3/4iPad/Laptop/Xbox/Watch/PC/Camera/Electronic with Case & Magnetic Pad - Blue…",https://m.media-amazon.com/images/I/61rmQdnL0cL._AC_UL320_.jpg,https://www.amazon.ca/dp/B088RBWX9V,4.6,1255,26.98,0,Industrial  Scientific,FALSE,0
B0BRX6YW9H,"iSANMATE PLA 3D Printer Filament, PLA Filament 1.75mm Bundle Dual Color Filament Silk PLA, Dimensional Accuracy +/- 0.02 mm, 250g x 4 Pack",https://m.media-amazon.com/images/I/81SPjRL6nWL._AC_UL320_.jpg,https://www.amazon.ca/dp/B0BRX6YW9H,4.4,620,41.99,0,Industrial  Scientific,FALSE,50
B08MKVLLW2,Headgear Strap Replacement for ResMed AirFit P10™ Nasal Pillow CPAP Mask for Her by Snugell™ | Pink Color | Pack of Two Straps | Includes Four Adjustment Clips | Durable Premium Material,https://m.media-amazon.com/images/I/81R-fGzToXL._AC_UL320_.jpg,https://www.amazon.ca/dp/B08MKVLLW2,4.5,642,31.99,0,Industrial  Scientific,FALSE,50
B0868M7WML,"ALINKER DisplayPort to DVI Cable, DP to DVI Display Cable Male to Male Gold-Plated Cord 6 Feet",https://m.media-amazon.com/images/I/51ujX+XqEwL._AC_UL320_.jpg,https://www.amazon.ca/dp/B0868M7WML,4.4,134,11.99,0,Industrial  Scientific,FALSE,0
B09XFKZB2C,"BNX 16x25x1 MERV 13 Air Filter 4 Pack - MADE IN USA - Electrostatic Pleated Air Conditioner HVAC AC Furnace Filters - Removes Pollen, Mold, Bacteria, Smoke",https://m.media-amazon.com/images/I/71chl-PGlxL._AC_UL320_.jpg,https://www.amazon.ca/dp/B09XFKZB2C,4.6,3155,67.25,0,Industrial  Scientific,FALSE,0
B003W0BZHC,"Aleene's 26413 Spray Acrylic Sealer Matte Finish, 6-Ounce",https://m.media-amazon.com/images/I/612Kfp749YL._AC_UL320_.jpg,https://www.amazon.ca/dp/B003W0BZHC,4.5,24775,34.99,0,Industrial  Scientific,FALSE,50
B097TNCQHF,"KirlystonE Waterfall Bathroom Sink Faucet, Modern Style Single Handle Basin Faucet, Matte Black Stainless Steel Vanity Mixer Tap with Pop Up Drain",https://m.media-amazon.com/images/I/71a4+P+NWVS._AC_UL320_.jpg,https://www.amazon.ca/dp/B097TNCQHF,3.9,73,39.99,69.99,Industrial  Scientific,FALSE,0
B07GTFHF7M,5 Pieces Different Size Cleaning Supplies Drill Brush Attachment Kit with 6 Inch Extender Power Scrubber/Toilet Brush/Bathroom Shower Cleaner/Grout Cleaner/Scrub Brush/Tub and Floor Scrubber,https://m.media-amazon.com/images/I/81O0b6X-nHL._AC_UL320_.jpg,https://www.amazon.ca/dp/B07GTFHF7M,4.4,472,15.98,0,Industrial  Scientific,FALSE,50
B001E63FTM,"Scott 1000 Jumbo Roll JR. Commercial Toilet Paper (07805), 2-PLY, White, 12 Rolls / Case, 1000' / Roll",https://m.media-amazon.com/images/I/81hrqIQUOHL._AC_UL320_.jpg,https://www.amazon.ca/dp/B001E63FTM,4.4,346,120.42,0,Industrial  Scientific,FALSE,0
B0BWXZRK1J,"Knomix Replacement Charging Charge Cable Cord 1.2M Compatible with Logitech UE Boom/Boom 2/ Boom 3 Megaboom, Miniboom, Roll Wireless Speaker and Logitech Headphone",https://m.media-amazon.com/images/I/51EeM0mN3mL._AC_UL320_.jpg,https://www.amazon.ca/dp/B0BWXZRK1J,5,9,9.98,0,Industrial  Scientific,FALSE,50
B005FQDHF4,Standard Extended-Reach Multi-Bit Screwdriver/Nut Driver,https://m.media-amazon.com/images/I/516UhfUKmUL._AC_UL320_.jpg,https://www.amazon.ca/dp/B005FQDHF4,4.8,672,26.22,27.98,Industrial  Scientific,FALSE,50
B07C4B3DL4,"PChero 2Packs L298N Motor Drive Controller Board Module, Dual H Bridge DC Stepper for Arduino Smart Car Robot",https://m.media-amazon.com/images/I/61buC7nMo+L._AC_UL320_.jpg,https://www.amazon.ca/dp/B07C4B3DL4,4.4,127,14.99,0,Industrial  Scientific,FALSE,0
B083NPTMF3,Bonvoisin Lab Scale 5000gx0.01g High Precision Electronic Analytical Balance 0.01g Accuracy Laboratory/Lab/Precision/Digital/Kitchen/Jewelry/Scientific Scale,https://m.media-amazon.com/images/I/612tWMYE6ZL._AC_UL320_.jpg,https://www.amazon.ca/dp/B083NPTMF3,4.4,264,157.88,0,Industrial  Scientific,FALSE,0
B09HGF4YBB,VEVOR 85-2 Magnetic Mixer Hotplate 1000ml Magnetic Heating Plate Magnetic Stirrer with Hotplate 110V Magnetic Stirring Mixer,https://m.media-amazon.com/images/I/61fmRu5qu5L._AC_UL320_.jpg,https://www.amazon.ca/dp/B09HGF4YBB,3.3,20,84.8,0,Industrial  Scientific,FALSE,0
B08DNRS8DQ,"Diamond Drill Bit Set 15PCS Hole Saw Set Drill Bits for Tiles Glass Marble Granite Stone Ceramic Marble Bottles DIY (6mm-50mm) (15, Silver)",https://m.media-amazon.com/images/I/61y39B5jhcL._AC_UL320_.jpg,https://www.amazon.ca/dp/B08DNRS8DQ,3.9,109,15.99,17.9,Industrial  Scientific,FALSE,50
B09MLT7XJH,"Nut and Bolt Thread Checker (Inch & Metric) -26 Male/Female Thread Identifier Gauges - 14 Inch & 12 Metric, Male/Female Gauges for Quickly Checking Nuts and Bolts Inch or Metric and Verifying The Size",https://m.media-amazon.com/images/I/61DrMlSzEQL._AC_UL320_.jpg,https://www.amazon.ca/dp/B09MLT7XJH,4.7,199,29.99,0,Industrial  Scientific,TRUE,50
B09H14HJJX,"Pizza Carrier Insulated Bags Large for Deliveries, Insulated Pizza Carrier Delivery Bag 20x20 Food Bag",https://m.media-amazon.com/images/I/718m3lX9H6L._AC_UL320_.jpg,https://www.amazon.ca/dp/B09H14HJJX,4.7,804,24.99,0,Industrial  Scientific,FALSE,50
B09NLXTPCZ,Automatic Measured Bottle Pourer - 1 oz (30 mL) Quick Shot Spirit Measure Pourer Drinks Wine Cocktail Dispenser Home Bar Tools (3),https://m.media-amazon.com/images/I/614IJxhsudL._AC_UL320_.jpg,https://www.amazon.ca/dp/B09NLXTPCZ,3.7,121,11.99,0,Industrial  Scientific,FALSE,50
B08HGNGJGX,[50 PACK] 5-Ply Black Kids Disposable Face Mask: Premium Material and Comfortable Fit for Safe and Effective Protection,https://m.media-amazon.com/images/I/81qta4tC3kL._AC_UL320_.jpg,https://www.amazon.ca/dp/B08HGNGJGX,4,167,39.95,0,Industrial  Scientific,FALSE,50
B081BB7ZQ2,PEAKTOW PTR0012 RV Adjustable Screen Door Cross Bar Handle w/Sturdy and Secure Non-Slip Grip,https://m.media-amazon.com/images/I/51OtjypxfRL._AC_UL320_.jpg,https://www.amazon.ca/dp/B081BB7ZQ2,4.6,376,18.99,0,Industrial  Scientific,FALSE,50
B089WJ1KF9,"Sugru by Tesa - All Purpose Super Glue, Moldable Craft Glue for Indoor & Outdoor - Adhesive Glue for Creative Fixing, Repairing, Bonding & Personalizing - 8 Pack - White (3.5g/ea)",https://m.media-amazon.com/images/I/61U1otJDlXL._AC_UL320_.jpg,https://www.amazon.ca/dp/B089WJ1KF9,4.5,653,33.44,0,Industrial  Scientific,FALSE,0
B0009ZAT1G,9-Inch High-Leverage Diagonal-Cutting Pliers,https://m.media-amazon.com/images/I/41QcUzpmIlL._AC_UL320_.jpg,https://www.amazon.ca/dp/B0009ZAT1G,4.8,5449,57.19,0,Industrial  Scientific,FALSE,50
B07P5MGLR7,"GMY MR16 Halogen Bulb 50W, Dimmable 12V GU5.3 Spotlight, 4000Hrs Long Lifetime, 3000K Warm White 800LM, 36° Beam Angle Bi-Pin Base 6Pack",https://m.media-amazon.com/images/I/71HXKmU79zS._AC_UL320_.jpg,https://www.amazon.ca/dp/B07P5MGLR7,4.4,744,22.89,0,Industrial  Scientific,FALSE,0
B0B4XYTRJX,T SHIRT BAGS LARGE 12+7X23 .0.017MM 100PCS,https://m.media-amazon.com/images/I/11zyAc1JSPL._AC_UL320_.jpg,https://www.amazon.ca/dp/B0B4XYTRJX,4.4,113,17,0,Industrial  Scientific,FALSE,50
B0BNV79555,"Okllen 60 Pack Sublimation Blank Coaster, Round Sublimation Blank Cup Mat, Rubber Heat Transfer Press Cup Coaster, 4 Inches/10 CM",https://m.media-amazon.com/images/I/81dBKx3eM5L._AC_UL320_.jpg,https://www.amazon.ca/dp/B0BNV79555,4.7,13,22.99,24.99,Industrial  Scientific,FALSE,0
B0B82DXNC9,"VOLTME 60W USB C Cable, QC3.0 USB A to C Charging Cable, 3A Type C Fast Charging Cord for MacBook Pro 2020, iPad Pro 2021, iPad Air 5, Galaxy S21, Pixel, Switch, Green (6ft/1.8m)",https://m.media-amazon.com/images/I/51WUmwKP8ML._AC_UL320_.jpg,https://www.amazon.ca/dp/B0B82DXNC9,4.5,81,13.99,0,Industrial  Scientific,FALSE,0
B083NQJJ3G,Bonvoisin 5000g x 0.01g (10mg) Analytical Balance Digital High Precision Electronic Lab/Jewelry/Kitchen/Scientific/Laboratory Scale,https://m.media-amazon.com/images/I/61ogm3reNxL._AC_UL320_.jpg,https://www.amazon.ca/dp/B083NQJJ3G,4.2,287,157.88,0,Industrial  Scientific,FALSE,0
B083R7KP3P,"10 Packs Plastic Syringe with Measurement, No Needle Suitable for Scientific Labs, Measuring, Watering, Refilling (2.5ml)",https://m.media-amazon.com/images/I/71pmMmHBa1L._AC_UL320_.jpg,https://www.amazon.ca/dp/B083R7KP3P,4.1,66,10.79,0,Industrial  Scientific,FALSE,0
B01EWNUUUA,ELEGOO Mega 2560 Project The Most Complete Ultimate Starter Kit w/Tutorial for Arduino Mega2560 UNO Nano,https://m.media-amazon.com/images/I/91loFcI3xTS._AC_UL320_.jpg,https://www.amazon.ca/dp/B01EWNUUUA,4.6,6503,95.99,0,Industrial  Scientific,FALSE,100
B07WCN4KYB,NEMA 6-50P to 14-50R 240V 50 Amp Compact Power Cord Adapter Connector Connecter for Welder Welding Dryer EV Charger,https://m.media-amazon.com/images/I/812iodF8G2L._AC_UL320_.jpg,https://www.amazon.ca/dp/B07WCN4KYB,4.4,48,34.7,0,Industrial  Scientific,FALSE,50
B08BP9LHLY,"Flicker Flame Light Bulb, Clear Flame Tip Candelabra Replacement Bulbs with a Flickering Orange Glow, 1 Watt/120 Volts/ E12 Flame Candelabra Base Bulbs, 12 Pack",https://m.media-amazon.com/images/I/61ZDYT07hCL._AC_UL320_.jpg,https://www.amazon.ca/dp/B08BP9LHLY,4.3,255,21.99,0,Industrial  Scientific,FALSE,50
B08ZRY3JC5,"Padlock with Key, [2 Pack] [4 Keys] Diyife Waterproof Lock Key Padlocks Outdoor, 40mm Heavy Duty Padlocks Anticut, Laminated Steel for School, Gym Locker, Garage, Fence, Shed, Yard",https://m.media-amazon.com/images/I/61BgxoqIAPL._AC_UL320_.jpg,https://www.amazon.ca/dp/B08ZRY3JC5,4,404,19.99,0,Industrial  Scientific,FALSE,0
B08N6LGKPL,"BENFEI USB to VGA Cable, 1.8 Meter USB 3.0 to VGA Male to Male Cable",https://m.media-amazon.com/images/I/61O-9PFHjOL._AC_UL320_.jpg,https://www.amazon.ca/dp/B08N6LGKPL,4.1,1524,21.59,0,Industrial  Scientific,FALSE,100
B08TZM3LWZ,LINCONSON Ultimate Grip Construction & Mechanic Thin Work Gloves with PU Palm Coating,https://m.media-amazon.com/images/I/81Mbvf5Hu9L._AC_UL320_.jpg,https://www.amazon.ca/dp/B08TZM3LWZ,4.1,717,21.99,0,Industrial  Scientific,FALSE,50
B0062IBF0S,Bosch BS9312-4F 93-1/2-Inch by 1/2-Inch by 4TPI Skip Wood Bandsaw Blade Silver,https://m.media-amazon.com/images/I/615ahq+eK4L._AC_UL320_.jpg,https://www.amazon.ca/dp/B0062IBF0S,4.3,331,24.99,0,Industrial  Scientific,FALSE,0
B0796R4LKS,"AQUACREST RV Inline Water Filter, NSF Certified, Reduces Chlorine, Bad Taste, Odor for RV and Marines, Drinking & Washing Filter, Pack of 2",https://m.media-amazon.com/images/I/71gVSUiBhrS._AC_UL320_.jpg,https://www.amazon.ca/dp/B0796R4LKS,4.5,2519,27.99,0,Industrial  Scientific,FALSE,50
B09XBQ2TS1,"Retractable Gap Dust Cleaner, Cleaning Artifact Under Appliance, Sofa Or Bed,Removable and Washable Telescopic Dust Collector Microfiber Cleaning Brush,Hand Duster (Gray)",https://m.media-amazon.com/images/I/51oykvi5FKL._AC_UL320_.jpg,https://www.amazon.ca/dp/B09XBQ2TS1,4.4,75,12.99,14.99,Industrial  Scientific,FALSE,50
B07V2YBDS5,"ISPINNER 52pcs Cable Clamps Assortment Kit, 304 Stainless Steel Rubber Cushion Pipe Clamps in 6 Sizes 1/4"" 5/16"" 3/8"" 1/2"" 5/8"" 3/4"" (Black)",https://m.media-amazon.com/images/I/81+EDJeIINL._AC_UL320_.jpg,https://www.amazon.ca/dp/B07V2YBDS5,4.7,1910,24.99,0,Industrial  Scientific,FALSE,0
