asin,title,imgUrl,productURL,stars,reviews,price,listPrice,categoryName,isBestSeller,boughtInLastMonth
B0B38VCLFW,"Square Tool and Carpenter Square Set,7 in. Aluminum Alloy Rafter Square +12in.Framing Square Combo,Upgraded L Square Ruler, Right Angle Ruler",https://m.media-amazon.com/images/I/71DB3WzSTWL._AC_UL320_.jpg,https://www.amazon.ca/dp/B0B38VCLFW,0,0,35.99,0,Industrial  Scientific,FALSE,0
B08D994CVB,5 Inch Hook and Loop Backing Pad 5'' Backing Plate with 5/8-11 Threads Sanding Pad Angle Grinder Accessories Sanding Buffing Polishing (1 Pack),https://m.media-amazon.com/images/I/712dVydJjIL._AC_UL320_.jpg,https://www.amazon.ca/dp/B08D994CVB,4.5,893,16.99,0,Industrial  Scientific,FALSE,100
B001DD04SQ,Rapid Response STR-15S25 Strep A Test Kit (Pack of 25),https://m.media-amazon.com/images/I/61Ilp01+E8L._AC_UL320_.jpg,https://www.amazon.ca/dp/B001DD04SQ,3.5,7,69.99,0,Industrial  Scientific,FALSE,100
B0BZH5FY9X,"VORXEON 9PCS Allen Wrench Hex Key Set, Metric Long Ball End Allen Key Set L-Key with Visible Coding for Bike Motorcycle Repair Furniture Assembly Household DIY (1.5mm-10mm)",https://m.media-amazon.com/images/I/61WnyHDA8qL._AC_UL320_.jpg,https://www.amazon.ca/dp/B0BZH5FY9X,4.7,363,16.99,0,Industrial  Scientific,FALSE,0
B08X65KFCN,"USB Printer Cable 10FT/3M USB 2.0 Type A Male to B Male Computer Scanner Cord High Speed Compatible for Brother, HP, Canon, Lexmark, Dell, Xerox, Samsung and More",https://m.media-amazon.com/images/I/71MGXNoM+yL._AC_UL320_.jpg,https://www.amazon.ca/dp/B08X65KFCN,4.7,573,9.99,0,Industrial  Scientific,FALSE,50
B0BLCB57TT,Foam Only 1 pair used earplug you will get.,https://m.media-amazon.com/images/I/31ktXCXORsL._AC_UL320_.jpg,https://www.amazon.ca/dp/B0BLCB57TT,4.1,149,10.99,13.99,Industrial  Scientific,FALSE,200
B08NJ7DLSP,"VEVOR Impact Socket Set 1/2 Inches 19 Piece Impact Sockets, Deep Socket, 6-Point Sockets, Cr-V, 1/2 Inches Drive Socket Set Impact 3/8 inch - 1-1/2 inch, with a Storage Cage, Blue",https://m.media-amazon.com/images/I/81tK3tTADvL._AC_UL320_.jpg,https://www.amazon.ca/dp/B08NJ7DLSP,4.7,334,99.99,110.16,Industrial  Scientific,FALSE,0
B08F55SKST,"LOVIMAG Magnetic Hooks Heavy Duty, 100LBS Strong Magnet Hooks for Hanging Heavy Duty, Magnetic Hooks for Cruise Cabins, Grill, Classroom, Home, Workplace, Office etc, 12pack",https://m.media-amazon.com/images/I/71qvSIrODIL._AC_UL320_.jpg,https://www.amazon.ca/dp/B08F55SKST,4.5,6675,34.49,36.9,Industrial  Scientific,FALSE,0
B0C4F6BBV7,"Keyless Entry Door Lock with Handles, UYF Electronic Keypad Deadbolt Lock with Lever, Front Door Lock Set, Auto Lock, Smart Digital Touchscreen with Fobs Code Key, Easy Installation",https://m.media-amazon.com/images/I/61JgNsmVTUL._AC_UL320_.jpg,https://www.amazon.ca/dp/B0C4F6BBV7,4.3,126,189.99,0,Industrial  Scientific,FALSE,0
B0B7MMDP7S,"KEZE 160PCS Silicone and Rubber Gasket for Shower Head Gasket Garden Hose Gasket for 1"", 3/4"", 1/2"", 3/8"", Pipe Repair",https://m.media-amazon.com/images/I/71JUdBRwB1L._AC_UL320_.jpg,https://www.amazon.ca/dp/B0B7MMDP7S,4.5,456,19.99,0,Industrial  Scientific,FALSE,50
B00M1XZXGU,"Slice 10514 Mini Cutter, Ceramic Safety Blade, Pocket Sized, Auto-Retractable, Stays Sharp up to 10X Longer, Grey",https://m.media-amazon.com/images/I/61WLFyggbAL._AC_UL320_.jpg,https://www.amazon.ca/dp/B00M1XZXGU,4.3,5766,16.63,19.29,Industrial  Scientific,FALSE,50
B08ZH7RF9W,"BIC Velocity Mechanical Pencils with Colored Leads, Medium Point (0.7 mm), 6-Count Pack, Perfect for Drawing and Journaling (MV7CP61-AST)",https://m.media-amazon.com/images/I/81XJHlko6QL._AC_UL320_.jpg,https://www.amazon.ca/dp/B08ZH7RF9W,4.3,1381,12.92,14.43,Industrial  Scientific,FALSE,50
B09ZP4246N,Spray Bottles Plastic Spraying Water Bottle 1000ml Empty Spray Bottle Cleaning with Adjustable Nozzle Trigger Sprayer for Housekeeping Office Plants Hair 2PCS,https://m.media-amazon.com/images/I/51J5ftKd75L._AC_UL320_.jpg,https://www.amazon.ca/dp/B09ZP4246N,4,42,14.99,0,Industrial  Scientific,FALSE,100
B01568S0NY,"Gala No Dust Floor Broom (Freedom from New Broom Dust- Busan), 2 Count",https://m.media-amazon.com/images/I/617Y+BFd9ES._AC_UL320_.jpg,https://www.amazon.ca/dp/B01568S0NY,3.9,13163,31.99,0,Industrial  Scientific,FALSE,50
B09PYQQYL6,"ELAMOR M19 - Keyless Entry Door Lock with Keypads, Electronic Deadbolt Lock, Auto Lock, 50 User Codes, Security Waterproof, Easy to Install, Ideal for Front Door, Home Use, Apartment",https://m.media-amazon.com/images/I/6114M0PutpL._AC_UL320_.jpg,https://www.amazon.ca/dp/B09PYQQYL6,4.1,175,69.99,0,Industrial  Scientific,FALSE,0
B00A1SQBPE,"Brady 58347, Flagging Tape, Yellow (1 Per Order)",https://m.media-amazon.com/images/I/816Qi-TGGLL._AC_UL320_.jpg,https://www.amazon.ca/dp/B00A1SQBPE,4.6,1298,6.09,0,Industrial  Scientific,FALSE,50
B00AANJVJ8,"Big D 680 Non-para Urinal Toss Block, Evergreen Fragrance, 1000 Flushes (Pack of 12) - Ideal for restrooms in Offices, Schools, Restaurants, Hotels, Stores - Urinal Deodorizer Cake Mint Puck",https://m.media-amazon.com/images/I/91jxEVt7CSL._AC_UL320_.jpg,https://www.amazon.ca/dp/B00AANJVJ8,3.7,107,23.98,0,Industrial  Scientific,FALSE,50
B007UXUC1C,"Master Lock, Brass, Padlock, ProSeries Set Your Own Combination Lock, 2-1/4 in. Wide, 1177D, No Size",https://m.media-amazon.com/images/I/61zMpDyY+8L._AC_UL320_.jpg,https://www.amazon.ca/dp/B007UXUC1C,4.2,1202,25.05,34,Industrial  Scientific,FALSE,0
B09V1BG1DN,"Mini Full Body Human Skeleton Model for Anatomy, Human Skeleton Model with Movable Arms and Legs on Plastic Base for Medical Teaching Learning, Kids Learning Education Display Tool",https://m.media-amazon.com/images/I/61fY0U2rdVL._AC_UL320_.jpg,https://www.amazon.ca/dp/B09V1BG1DN,3.5,16,30.99,0,Industrial  Scientific,FALSE,50
B097B8T51X,"100 PCS 5 Inch Sanding Disc 120 Grit, 8 Hole Sandpaper Hook and Loop Sanding Pads Round Orbital Sandpaper for Random Orbital Sander",https://m.media-amazon.com/images/I/91RNKXV5XbL._AC_UL320_.jpg,https://www.amazon.ca/dp/B097B8T51X,4.4,246,21.99,0,Industrial  Scientific,FALSE,50
B01A6WISSC,Makita 4100NH3ZX 4-3/8-Inch Masonry Saw,https://m.media-amazon.com/images/I/51iuC69XyCL._AC_UL320_.jpg,https://www.amazon.ca/dp/B01A6WISSC,4.3,189,139,0,Industrial  Scientific,FALSE,50
B083GNCYYL,"Gezond 350pcs Compostable Paper Plates Set, Eco-Friendly Heavy-Duty Disposable Paper Plates Cutlery Includes Biodegradable Plates, Forks, Knives, Spoons, Cups and Straws for 50 Guests",https://m.media-amazon.com/images/I/81EMomToDPL._AC_UL320_.jpg,https://www.amazon.ca/dp/B083GNCYYL,4.6,131,61.99,0,Industrial  Scientific,FALSE,50
B082NH9KVJ,"Topbuti 15 Pcs Mini Stainless Steel Wire Brush Set for Cleaning Welding Slag Rust, Wire Bristle Scratch Brush Set, Curved Handle Brushes",https://m.media-amazon.com/images/I/61x-lCebAbL._AC_UL320_.jpg,https://www.amazon.ca/dp/B082NH9KVJ,4.2,1195,11.95,0,Industrial  Scientific,FALSE,50
B07QM1VBJ6,"United Filter 16x20x4 MERV 11 Furnace Air Filters (Case of 4) - HVAC Filters Captures Airborne Dust, Pollen, Mould Spores & Smoke - Air Filters Made in Canada",https://m.media-amazon.com/images/I/71cK94d2ikL._AC_UL320_.jpg,https://www.amazon.ca/dp/B07QM1VBJ6,4.8,237,94.99,0,Industrial  Scientific,FALSE,0
B082GGF9GL,Kleenex Everyday 9 x Pocket Tissues Packs - 8 Packs Included Pack of 2,https://m.media-amazon.com/images/I/41Dsbg6EpeS._AC_UL320_.jpg,https://www.amazon.ca/dp/B082GGF9GL,4.7,1129,7.99,17.99,Industrial  Scientific,FALSE,0
B0CDH32WZQ,"UYF Fingerprint Door Lock,Keypad Door Lock with Fobs,Smart Locks for Front Door,Keyless Deadbolt for Front Door,Electronic Deadbolt for Bedroom,Digital Door Lock for Hotel,Black",https://m.media-amazon.com/images/I/61dCSC671CL._AC_UL320_.jpg,https://www.amazon.ca/dp/B0CDH32WZQ,4.3,420,99.99,159.99,Industrial  Scientific,FALSE,0
B076645YB7,"Southwire 64267201 Red/White Bell Wire, 50ft",https://m.media-amazon.com/images/I/614XWbbo6RL._AC_UL320_.jpg,https://www.amazon.ca/dp/B076645YB7,4.6,698,17.07,0,Industrial  Scientific,FALSE,0
B00SH2CG3C,"Command Assorted Outdoor Foam Refill Strips, White, 4 Medium Strips 2 Large Strips, 6 Count",https://m.media-amazon.com/images/I/81lVv6CTrVL._AC_UL320_.jpg,https://www.amazon.ca/dp/B00SH2CG3C,4.4,1835,6.29,0,Industrial  Scientific,FALSE,0
B0835KJZ5Y,"SOKA Centerset Bathroom Sink Faucet Two Handles High Arc 4"" Lavatory Bath Stainless Steel with Deck Plate & Pop-Up Drain Assembly Fit 3 Hole Installation, Brushed Nickel",https://m.media-amazon.com/images/I/71TBnYtPz+L._AC_UL320_.jpg,https://www.amazon.ca/dp/B0835KJZ5Y,4.3,1574,42.72,0,Industrial  Scientific,FALSE,0
B0BG4PXSLC,"Elongated Toilet Seat with Lid, Quiet Close, Slow Close Seat and Cover, White, 18.3Lx14.56W inches",https://m.media-amazon.com/images/I/51xGjbqve3L._AC_UL320_.jpg,https://www.amazon.ca/dp/B0BG4PXSLC,3.9,22,40.99,0,Industrial  Scientific,FALSE,0
B0BHS4ZNMQ,"Weather Stripping D-Type Door Seal Strip, 33Feet (10M) Door Soundproofing Door Noise Block, Collision Avoidance Corner Protector Foam Weather Strip for Door and Window by SUNMON (White)",https://m.media-amazon.com/images/I/61NWGZKdBuL._AC_UL320_.jpg,https://www.amazon.ca/dp/B0BHS4ZNMQ,4.1,494,17.99,0,Industrial  Scientific,FALSE,50
B0B77GCS4L,"Microfiber Feather Duster Kit, Extendable Pole Cobweb Duster with 2 Bendable Head, Reusable and Washable Dusters for Cleaning Ceiling Fan, High Ceiling, Cupboard, Blinds, Furniture & Cars",https://m.media-amazon.com/images/I/71YbreeRg8L._AC_UL320_.jpg,https://www.amazon.ca/dp/B0B77GCS4L,4.2,99,15.99,0,Industrial  Scientific,FALSE,100
B0056LI5PK,KOHLER K-4774-0 Brevia Elongated White Toilet Seatwith Quick-Release Hinges and Quick-Attach Hardware for Easy Clean,https://m.media-amazon.com/images/I/612UcANfSUL._AC_UL320_.jpg,https://www.amazon.ca/dp/B0056LI5PK,4.2,6617,52.99,61,Industrial  Scientific,FALSE,0
B07KHBZ2BP,"CRAFTSMAN V20 Cordless Brad Nailer Kit, 18GA (CMCN618C1)",https://m.media-amazon.com/images/I/71yqG88QPAL._AC_UL320_.jpg,https://www.amazon.ca/dp/B07KHBZ2BP,4.5,2562,285.37,299,Industrial  Scientific,FALSE,0
B0002KNZJ6,"Performance Tool W1173 SAE/Metric 40-Piece SAE and Metric Socket Set, 1/4 inch & 3/8 inch Drive",https://m.media-amazon.com/images/I/7172LGB3zdL._AC_UL320_.jpg,https://www.amazon.ca/dp/B0002KNZJ6,3.6,5893,21.25,0,Industrial  Scientific,FALSE,100
B0C5Q8MVMJ,"12W LED Corn Light Bulb - Equivalent 120W Incandescent, 1200LM, E26 Base Daylight 6500K Non-Dimmable, 4-Pack",https://m.media-amazon.com/images/I/51eDPqkmpML._AC_UL320_.jpg,https://www.amazon.ca/dp/B0C5Q8MVMJ,4.9,12,19.99,0,Industrial  Scientific,FALSE,50
B01MDTO6X7,UY CHAN Upgraded Original TS101 40W PD 65W DC Power Programmable Pocket-Size Smart Fast Heat Portable Soldering Iron Station Kit (B2 Kit),https://m.media-amazon.com/images/I/61eBdypQOiL._AC_UL320_.jpg,https://www.amazon.ca/dp/B01MDTO6X7,4.6,2159,109.99,0,Industrial  Scientific,FALSE,0
B09JBYMVDM,"Silk PLA Filament 1.75mm +/- 0.03mm, Update kexcelled 3D Printing Filament, Shiny Glossy Surface, 1kg Spool (2.2lbs), Fit Most FDM Printer, Tangle-Free, Vacuum Packaging, Ice Blue",https://m.media-amazon.com/images/I/71zy3NhF2ML._AC_UL320_.jpg,https://www.amazon.ca/dp/B09JBYMVDM,4.6,74,27.99,0,Industrial  Scientific,FALSE,0
B09QXZQTR4,"AdTech 220-145-5 4"" Full Size Hot Glue Sticks, 4 inch, Clear",https://m.media-amazon.com/images/I/71LU859j9XL._AC_UL320_.jpg,https://www.amazon.ca/dp/B09QXZQTR4,4.7,77,39.99,0,Industrial  Scientific,FALSE,50
B0C7KV3NFW,"Awaiymi 6Pcs Hard Hat Sweatband Washable, Cotton Hard Hat Liner,Reusable Hard Hat Accessories, Antiperspirant Belt Air Cushion Sweatband Helmet Comforter Pad",https://m.media-amazon.com/images/I/71Ud22XpY-L._AC_UL320_.jpg,https://www.amazon.ca/dp/B0C7KV3NFW,4.7,17,19.99,21.99,Industrial  Scientific,FALSE,100
B0BZHSJ3XK,"IPL Safety Goggles, Safety Beauty UV LED Eye Protection Glasses, LED Protective Glasses, UV Solarium Protective Glasses, for Sunbed Beauty Patients Sunglasses IPL Treatment LED Light Therapy, 4Pcs",https://m.media-amazon.com/images/I/41uBGxAvomL._AC_UL320_.jpg,https://www.amazon.ca/dp/B0BZHSJ3XK,4.4,3,11.99,0,Industrial  Scientific,FALSE,0
B09D76KLJL,"VIGRUE 495Pcs Aluminum Rivet Assortment Kit, Pop Rivets Blind Rivets 9 Sizes Assortment (495)",https://m.media-amazon.com/images/I/71dEx9Jy4LL._AC_UL320_.jpg,https://www.amazon.ca/dp/B09D76KLJL,4.5,157,29.99,0,Industrial  Scientific,FALSE,50
B0BCQ5RKXH,"Readaeer 3D Skull Ice Cube Mold Large Silicone Ice Skull Mold for Whiskey, Cocktails, Beer and Coffee",https://m.media-amazon.com/images/I/71LXPPKvH1L._AC_UL320_.jpg,https://www.amazon.ca/dp/B0BCQ5RKXH,4.6,358,22.99,0,Industrial  Scientific,FALSE,0
B074G4Z2S3,"VITAWRAP plastic wrap, cp 305 m",https://m.media-amazon.com/images/I/81YvgHzyXQL._AC_UL320_.jpg,https://www.amazon.ca/dp/B074G4Z2S3,4.5,238,24.99,0,Industrial  Scientific,FALSE,50
B0C7GWR6V7,GREEN DEVIL Universal Bump Cap Insert for Baseball Caps Vented Lightweight Safety Bump Hat Insert for Men Women 1 Pack,https://m.media-amazon.com/images/I/61hl6BD5WAL._AC_UL320_.jpg,https://www.amazon.ca/dp/B0C7GWR6V7,0,0,15.99,0,Industrial  Scientific,FALSE,0
B08PKX4YLZ,"eSUN 3D Printing Filament Vacuum Storage Kit, Spool Storage Sealing Bags Dust Proof Humidity Resistant for Keeping Filament Dry, 10 Vacuum Bags/Kit",https://m.media-amazon.com/images/I/71N+H6hCAXL._AC_UL320_.jpg,https://www.amazon.ca/dp/B08PKX4YLZ,4,1184,29.99,0,Industrial  Scientific,FALSE,50
B00JH41U7M,Deluxe Pallet Buster w/41 Handle,https://m.media-amazon.com/images/I/61OJ+ewA0jL._AC_UL320_.jpg,https://www.amazon.ca/dp/B00JH41U7M,4.6,317,104.36,122.78,Industrial  Scientific,FALSE,50
B00J48VHHE,California Costumes Witch's Broom,https://m.media-amazon.com/images/I/61StEmtGNML._AC_UL320_.jpg,https://www.amazon.ca/dp/B00J48VHHE,4.4,3239,20.75,22.01,Industrial  Scientific,FALSE,100
B0B2VK7TKL,"SLShePack 50 Pack 9 ½'' x 6'' 2'' Cookies Macaron Boxes for 12, Bakery Cakesicle Chocolate Covered Strawberries with Window Ore Cocoa Bombs Pastry White",https://m.media-amazon.com/images/I/61RHnah+QkL._AC_UL320_.jpg,https://www.amazon.ca/dp/B0B2VK7TKL,4.4,20,49.9,0,Industrial  Scientific,FALSE,0
B07PB355MN,14x25x1 MERV 11 Pleated Furnace Filters. Actual / Exact Size 13 1/2 x 24 1/2 x 3/4. Case of 12 Made in Canada by FurnaceFilters.ca,https://m.media-amazon.com/images/I/61B5jdE5MCL._AC_UL320_.jpg,https://www.amazon.ca/dp/B07PB355MN,4.7,37,89.99,0,Industrial  Scientific,FALSE,50
B0B4BFXNJ9,TEKTON 1/2 Inch Drive Split Beam Torque Wrench (40-250 ft.-lb.) | TRQ62203AMZ,https://m.media-amazon.com/images/I/51Tos2YqL4L._AC_UL320_.jpg,https://www.amazon.ca/dp/B0B4BFXNJ9,4.8,92,224.1,0,Industrial  Scientific,FALSE,0
B09XPXD1XD,"IEMAI Carbon Fiber PETG Filament, PETG Filament 1.75mm 3D Printer Filament, PETG Filament Filled 20% Carbon Fiber, 3D Printing Filament 1kg Spool Matte Black",https://m.media-amazon.com/images/I/71RKUcuMNoL._AC_UL320_.jpg,https://www.amazon.ca/dp/B09XPXD1XD,4.3,481,36.99,49.99,Industrial  Scientific,FALSE,50
B009EE2RQS,"Perfect Stix Wooden Coffee Stirrer Stick, 7-1/2"" Length (Pack of 1,000)",https://m.media-amazon.com/images/I/81iR9b90T3L._AC_UL320_.jpg,https://www.amazon.ca/dp/B009EE2RQS,4.4,268,16.55,0,Industrial  Scientific,FALSE,50
B07JY2MWLF,DEWALT 20V MAX Random Orbital Sander Kit (DCW210P1),https://m.media-amazon.com/images/I/61rCwV36LIL._AC_UL320_.jpg,https://www.amazon.ca/dp/B07JY2MWLF,4.6,328,219,329,Industrial  Scientific,FALSE,50
B0832ZFKH3,"MMOBIEL T-7000 Multipurpose High Performance Industrial Glue Semi Fluid Black Adhesive Incl. Precision Tips for Clean Working (15ML / 0,51 oz)",https://m.media-amazon.com/images/I/51h3Ih66owL._AC_UL320_.jpg,https://www.amazon.ca/dp/B0832ZFKH3,4.3,462,11.99,0,Industrial  Scientific,FALSE,50
B007P8CZS0,Mack's 6 pair Pillow Soft Ear Plugs - Kid Size,https://m.media-amazon.com/images/I/71Zgpb6NGdL._AC_UL320_.jpg,https://www.amazon.ca/dp/B007P8CZS0,3.9,3228,9.25,0,Industrial  Scientific,FALSE,100
B07798M1S2,"Prime-Line MPSC7841-100 Drywall Screws, 6 x 1-1/4 Inch, Coarse Thread, Phillips Drive, Flat Head, Pack of 100, 100 Piece",https://m.media-amazon.com/images/I/41mxuIp2+DL._AC_UL320_.jpg,https://www.amazon.ca/dp/B07798M1S2,4.5,1564,8.76,0,Industrial  Scientific,FALSE,0
B00P2AW1ZU,Ewinever 6-Pack Tourniquet Elastic First Aid Quick Release Medical Sport Emergency Buckle Band,https://m.media-amazon.com/images/I/41iSNqH8OVL._AC_UL320_.jpg,https://www.amazon.ca/dp/B00P2AW1ZU,4.2,2491,10.99,0,Industrial  Scientific,FALSE,50
B07KYDG54V,"Globe Light Bulbs, Comzler G25 LED Vanity Light Bulb 80W Equivalent, E26 LED Bulb 2700K Soft White, Vanity Bulbs for Bathroom, Makeup Mirror Lights for Bedroom, 900LM, Non-Dimmable, Pack of 4",https://m.media-amazon.com/images/I/61TqLpLkiXL._AC_UL320_.jpg,https://www.amazon.ca/dp/B07KYDG54V,4.7,2556,21.99,0,Industrial  Scientific,FALSE,0
B09YC7PTM3,"2 Tier Wine Rack，Tabletop Stackable Wine Rack Freestanding Wine Racks Countertop for Kitchen Pantry Cabinet for Kitchen, Bar, Pantry, Wine Cellar, Basement, Countertop, Cabinet",https://m.media-amazon.com/images/I/715me0GNAcL._AC_UL320_.jpg,https://www.amazon.ca/dp/B09YC7PTM3,4.4,78,29.99,0,Industrial  Scientific,FALSE,50
B0932MS1ZR,"1ft Right Angle Lightning Cable Short, 3 Pack Braided Fast Charging USB to iPhone Charger Cord 90 Degree Compatible with Apple iPhone 12 11 Pro Max Xs Xr X 5 6 7 8 Plus SE, iPad Air/Mini …",https://m.media-amazon.com/images/I/71kDZbHsobS._AC_UL320_.jpg,https://www.amazon.ca/dp/B0932MS1ZR,4.3,1246,9.97,0,Industrial  Scientific,FALSE,50
B09R2B456K,"LEXIVON 3/4-Inch Impact Socket Adapter, 3/4"" Female x 1/2"" Male Reducer | Chrome-Molybdenum alloy steel = Fully Impact Rated (LX-402)",https://m.media-amazon.com/images/I/51cx69DoSQL._AC_UL320_.jpg,https://www.amazon.ca/dp/B09R2B456K,4.6,215,16.99,29.99,Industrial  Scientific,FALSE,0
B0C3DJ55SB,"ProPOW Radar Motion Sensor Light Bulbs, A19 12W (100 Watt Equivalent) Daylight 5000K E26 Outdoor Auto on/Off Motion Detector Lights for Outside, Porch, Garage, Driveway, Patio,(1100LM, 2-Pack)",https://m.media-amazon.com/images/I/51VVXWSAAGL._AC_UL320_.jpg,https://www.amazon.ca/dp/B0C3DJ55SB,4.2,37,22.99,0,Industrial  Scientific,FALSE,0
B09Z5ZBGF9,"AMIR Key Lock Box Wall Mounted, Waterproof Lock Box for House Key, 4 Digit Combination Lockbox for Keys with Resettable Code House Key Safe Security Lock Box for Outside Realtors (1 Pack)",https://m.media-amazon.com/images/I/61YdsVJ8w7L._AC_UL320_.jpg,https://www.amazon.ca/dp/B09Z5ZBGF9,3.9,26,17.99,0,Industrial  Scientific,FALSE,0
B08V1HGYMX,"Inkbird IBS-TH2 Plus Bluetooth Temperature and Humidity Monitor Thermometer&Hygrometer, Smart Sensor Data Logger Ideal for Home, Office, Greenhouse, Humidor, Cellar（External Temperature Probe）",https://m.media-amazon.com/images/I/51q6IKnyiML._AC_UL320_.jpg,https://www.amazon.ca/dp/B08V1HGYMX,4,124,29.99,0,Industrial  Scientific,FALSE,50
B084GM15PD,"ilikable iPhone Charger Cable, 3 Pack 3ft 6ft 10ft MFi Certified Lightning Cable, Compatible with iPhone 13 12 11 / XS/XR/X/ 8/7/ 6s / SE, iPad Mini/Air, iPod, Airpods - White",https://m.media-amazon.com/images/I/61neb0zBNAL._AC_UL320_.jpg,https://www.amazon.ca/dp/B084GM15PD,4.3,1710,14.99,0,Industrial  Scientific,FALSE,0
B09XB8ZMNK,"Multi 5 in 1 Universal 3A Fast Charge USB Charging Cable,1.8M/6FT USB A/Type C to Lightning +Type C+Micro USB Nylon Braided Sync Charger Cord Adapter for Android/iPhone/Apple/iOS/Samsung/Huawei/XiaoMi",https://m.media-amazon.com/images/I/61yRuHooCRL._AC_UL320_.jpg,https://www.amazon.ca/dp/B09XB8ZMNK,4.3,721,17.99,19.99,Industrial  Scientific,FALSE,0
B086W1XLQ7,"Kihung T8 LED Bulbs 4 Foot, Type B Ballast Bypass, Dual-Ended Power, G13 Base, 24W 3120LM 6000K Daylight White, Compatible with T8 T10 T12 Tubes, 4ft Fluorescent Bulb Replacement, 4-Pack",https://m.media-amazon.com/images/I/61-uEJzCiFL._AC_UL320_.jpg,https://www.amazon.ca/dp/B086W1XLQ7,4.3,440,59.99,0,Industrial  Scientific,FALSE,50
B07B3PY2GC,"3M DT8 Industrial Strength Multi-Use Duct Tape, Silver 1.88in x 60 yd x 8 mil thickness – Professional Grade Adhesive, 1 Pack",https://m.media-amazon.com/images/I/81BwteVMJRL._AC_UL320_.jpg,https://www.amazon.ca/dp/B07B3PY2GC,4.6,756,15.79,0,Industrial  Scientific,FALSE,50
B098X5FL9V,"60Pcs Sanding Discs, iNUREYE 5 Inch 8 Hole Wet Dry Sandpaper, 240 320 400 600 800 1000 1200 1500 2000 3000 Assorted Grit Hook and Loop Sanding Sheets for Random Orbital Sanders (240-3000 Grit)",https://m.media-amazon.com/images/I/81Jhl0MEFfL._AC_UL320_.jpg,https://www.amazon.ca/dp/B098X5FL9V,4.5,95,24.97,0,Industrial  Scientific,FALSE,50
B07PVBZ71R,"CCTV Video Surveillance Security Stickers, Blue and White Octagon-Shaped,84mm X 84mm Vinyl Decals - Indoor & Outdoor Use, UV Protected & Waterproof - 6 Labels",https://m.media-amazon.com/images/I/81Lu417o9LL._AC_UL320_.jpg,https://www.amazon.ca/dp/B07PVBZ71R,4.4,106,9.1,0,Industrial  Scientific,FALSE,50
B09TPGQY83,"V7 V8 Vacuum Filter Replacement Kit Compatible with Dyson V7, V8 Animal and V8 Absolute Cordless Vacuum, 3 HEPA Column Filter, 3 Pre-Filter, Replaces Part # 965661-01 & 967478-01",https://m.media-amazon.com/images/I/714moqvXLTL._AC_UL320_.jpg,https://www.amazon.ca/dp/B09TPGQY83,4.7,98,23.99,0,Industrial  Scientific,FALSE,50
B06XH6H26X,Freeman Pneumatics P23-138 23 Gauge 1-3/8” Headless Micro Pins,https://m.media-amazon.com/images/I/81XnSJssHIL._AC_UL320_.jpg,https://www.amazon.ca/dp/B06XH6H26X,4.6,638,16.52,0,Industrial  Scientific,FALSE,50
B07CB7VYB2,14 Pcs M6 3D Printer Nozzle 0.4mm Extruder Brass Nozzle Print Head for 1.75mm Filament E3D V5 V6 Makerbot,https://m.media-amazon.com/images/I/51OpcEd1sML._AC_UL320_.jpg,https://www.amazon.ca/dp/B07CB7VYB2,4.2,350,12.49,0,Industrial  Scientific,FALSE,0
B09JWV7V3W,Flare Calmer Mini – Small Ear Plugs Alternative – Reduce Annoying Noises Without Blocking Sound – Soft Reusable Silicone - Purple,https://m.media-amazon.com/images/I/41OQ59o6z3L._AC_UL320_.jpg,https://www.amazon.ca/dp/B09JWV7V3W,3.4,1498,34.95,0,Industrial  Scientific,FALSE,50
B08FX3ZF9X,"Hand-held Alcohol Refractometer,V·RESOURCING 0~80% Alcohol Content Measurement Tool Tester;Widely Used in Scientific Research, Alcohol Purchase",https://m.media-amazon.com/images/I/61Uw8LlOa+L._AC_UL320_.jpg,https://www.amazon.ca/dp/B08FX3ZF9X,4.3,124,25.99,0,Industrial  Scientific,FALSE,0
B009NKXIKW,"Tork Universal SK1850A Singlefold Paper Hand Towel, 1-Ply, 10.25"" Width x 9.13"" Length, Natural, (Case of 16 Packs, 250 per Pack, 4,000 Towels)",https://m.media-amazon.com/images/I/81+Y-s9ANtL._AC_UL320_.jpg,https://www.amazon.ca/dp/B009NKXIKW,4.4,504,63.49,0,Industrial  Scientific,FALSE,50
B08B12R9R6,"Wood Drink Coasters with Metal Holder, GOH DODD 4 Inch 8 Pieces Wooden Coasters Cup Coaster Set for Bar Kitchen Home Apartment, Walnut Wood",https://m.media-amazon.com/images/I/71HzhaH3n0L._AC_UL320_.jpg,https://www.amazon.ca/dp/B08B12R9R6,4.5,432,22.99,0,Industrial  Scientific,FALSE,50
B07QMP57DG,"Simba Lighting LED GU10 5W Non-Dimmable Spot Light Bulb (6 Pack) Halogen 50W Replacement MR16 Shape for Accent, Recessed, Track Lighting, 38° Beam, 120V, Twist-N-Lock Bipin Base, 5000K Daylight",https://m.media-amazon.com/images/I/71N+LAXQ2FL._AC_UL320_.jpg,https://www.amazon.ca/dp/B07QMP57DG,4.5,459,20.95,0,Industrial  Scientific,FALSE,0
B0B5BZ2VWX,"25 Pack 1ml 30Ga 0.5 Inches Plastic Measuring Cylinder, Individually Sealed Packaged",https://m.media-amazon.com/images/I/51jLpraU4gL._AC_UL320_.jpg,https://www.amazon.ca/dp/B0B5BZ2VWX,4.6,13,19.59,0,Industrial  Scientific,FALSE,0
B0009ON12G,"Yellow Jacket 2884 12/3 Heavy-Duty 15-Amp SJTW Contractor Extension Cord with Lighted Ends, 50-Feet",https://m.media-amazon.com/images/I/71Jtkvaf1HL._AC_UL320_.jpg,https://www.amazon.ca/dp/B0009ON12G,4.8,1205,61.26,0,Industrial  Scientific,FALSE,0
B076HD7KFV,"SinLoon RJ45 Splitter Adapter, Ethernet Cable Splitter, RJ45 Network Extension Connector Ethernet Cable Sharing Kit for Router TV Box Camera PC Lapop 2 PCS (Black)",https://m.media-amazon.com/images/I/61eQA4jJtzL._AC_UL320_.jpg,https://www.amazon.ca/dp/B076HD7KFV,3.6,1909,12.8,13.99,Industrial  Scientific,FALSE,50
B0BLNHS5RM,"Whetstone Sharpening Stone, Knife Sharpening Stone of 400/1000/3000/8000 grit, Knife Sharpener Kit with Non-Slip Bamboo Base, Flattening Stone, Angle Guide, Leather Strop, Suitable for Knives",https://m.media-amazon.com/images/I/61wYcXFY65L._AC_UL320_.jpg,https://www.amazon.ca/dp/B0BLNHS5RM,4.4,85,25.73,29.67,Industrial  Scientific,FALSE,0
B07ZM7MRF6,"GuDoQi Mini Vacuum Cleaner, Handheld Vacuum Energy Saving, USB Rechargeable, 90 Minutes Runtime, 360° Rotatable Desk Vacuum Cleaner for Keyboard, Home, School, Office",https://m.media-amazon.com/images/I/51Hd3A+kFJL._AC_UL320_.jpg,https://www.amazon.ca/dp/B07ZM7MRF6,4,1089,18.99,0,Industrial  Scientific,FALSE,50
B00424S2C8,"MG Chemicals 400-NS Series #3 No Clean Super Wick Desoldering Braid, 0.075"" Width x 5' Length, Green (425-NS)",https://m.media-amazon.com/images/I/81KqX5IfgHL._AC_UL320_.jpg,https://www.amazon.ca/dp/B00424S2C8,4.6,1097,5.51,0,Industrial  Scientific,FALSE,50
B08RXVH379,"BEHENO 8 PCS Q-Hanger, Screw Hooks for Outdoor String Lights - Ceiling Hooks for Hanging Plants Wind Chimes, Safety Buckle Design, Windproof, 2.2 Inches",https://m.media-amazon.com/images/I/61YJlrE0BoL._AC_UL320_.jpg,https://www.amazon.ca/dp/B08RXVH379,4.7,5321,9.89,0,Industrial  Scientific,FALSE,0
B07BGGYYV1,"Fit Meal Prep 12 LB 13 x 7 x 4.5"" Heavy Duty Kraft Paper Bags Grocery Lunch Retail Shopping Durable Natural Brown Barrel Sack [150 Pack]",https://m.media-amazon.com/images/I/71gg7u+1JoL._AC_UL320_.jpg,https://www.amazon.ca/dp/B07BGGYYV1,4.3,397,29.86,0,Industrial  Scientific,FALSE,0
B00NP0E7SI,Brinks 675-83001 Heavy Duty Dual Function Door Security Bar,https://m.media-amazon.com/images/I/31jqwroIa8L._AC_UL320_.jpg,https://www.amazon.ca/dp/B00NP0E7SI,4.4,7210,64.19,0,Industrial  Scientific,FALSE,0
